symbol,name,currency,summary,category_group,category,family,exchange,isin,trading_days,last_price,avg_volume,avg_dollar_volume,liquidity_rank,asset_type,size_metric,market_bucket,candidate_status,candidate_fail_reasons
IJH,iShares Core S&P Mid-Cap ETF,USD,"The investment seeks to track the investment results of the S&P MidCap 400 (the ""underlying index""), which measures the performance of the mid-capitalization sector of the U.S. equity market.
 The fund generally invests at least 90% of its assets in securities of the underlying index and in depositary receipts representing securities of the underlying index. It may invest the remainder of its assets in certain futures, options and swap contracts, cash and cash equivalents, as well as in securities not included in the underlying index, but which the advisor believes will help the fund track the underlying index.",Financials,Mid Cap,BlackRock Asset Management,PCX,,124,71.36000061035156,14050375.0,954053450.7375872,44,ETF,18368063488.0,equity,PASS,
GLDM,SPDR Gold MiniShares,USD,"The investment seeks to reflect the performance of the price of gold bullion, less the expenses of operations.
 The Shares are designed for investors who want a cost-effective and convenient way to invest in gold. Advantages of investing in the Shares include ease and flexibility of investment and expenses.",Commodities,,State Street Global Advisors,PCX,,124,94.91000366210938,9546073.387096774,881560945.2857971,47,ETF,29616130048.0,commodity,PASS,
IWD,iShares Russell 1000 Value ETF,USD,"The investment seeks to track the investment results of the Russell 1000Â® Value Index (the ""underlying index""), which measures the performance of large- and mid- capitalization value sectors of the U.S. equity market.
 The fund generally invests at least 90% of its assets in securities of the underlying index and in depositary receipts representing securities of the underlying index. It may invest the remainder of its assets in certain futures, options and swap contracts, cash and cash equivalents, as well as in securities not included in the underlying index, but which the advisor believes will help the fund track the underlying index.",Equities,Value,BlackRock Asset Management,PCX,,124,224.02000427246097,4139978.2258064514,878073301.0478358,48,ETF,68415709184.0,equity,PASS,
VTV,Vanguard Value Index Fund ETF Shares,USD,"The investment seeks to track the performance of a benchmark index that measures the investment return of large-capitalization value stocks.
 The fund employs an indexing investment approach designed to track the performance of the CRSP US Large Cap Value Index, a broadly diversified index predominantly made up of value stocks of large U.S. companies. The advisor attempts to replicate the target index by investing all, or substantially all, of its assets in the stocks that make up the index, holding each stock in approximately the same proportion as its weighting in the index.",Financials,Value,Vanguard Asset Management,PCX,,124,202.0399932861328,4395345.9677419355,852864089.940188,50,ETF,85715673088.0,equity,PASS,
KWEB,KraneShares CSI China Internet ETF,USD,"The investment seeks to provide investment results that, before fees and expenses, correspond generally to the price and yield performance of the CSI Overseas China Internet Index.
 The fund invests at least 80% of its total assets in equity securities of the index and in depositary receipts representing such securities. The index is designed to measure the equity market performance of the investable universe of publicly traded China-based companies whose primary business or businesses are in the Internet and Internet-related sectors, and are listed outside of Mainland China, as determined by the index provider. The fund is non-diversified.",Information Technology,Emerging Markets,KraneShares,PCX,IE00BFXR7892,124,29.63999938964844,22405714.51612903,755118974.842027,52,ETF,6039135744.0,equity,PASS,
IJR,iShares Core S&P Small-Cap ETF,USD,"The investment seeks to track the investment results of the S&P SmallCap 600 (the ""underlying index""), which measures the performance of the small-capitalization sector of the U.S. equity market.
 The fund generally invests at least 90% of its assets in securities of the underlying index and in depositary receipts representing securities of the underlying index. It may invest the remainder of its assets in certain futures, options and swap contracts, cash and cash equivalents, as well as in securities not included in the underlying index, but which the advisor believes will help the fund track the underlying index.",Financials,Small Cap,BlackRock Asset Management,PCX,,124,132.25999450683594,6042660.483870967,747998264.3618307,53,ETF,74826096640.0,equity,PASS,
XLB,Materials Select Sector SPDR Fund,USD,"The investment seeks to provide investment results that, before expenses, correspond generally to the price and yield performance of publicly traded equity securities of companies in the Materials Select Sector Index.
 In seeking to track the performance of the index, the fund employs a replication strategy. It generally invests substantially all, but at least 95%, of its total assets in the securities comprising the index. The index includes securities of companies from the following industries: chemicals; metals and mining; paper and forest products; containers and packaging; and construction materials. The fund is non-diversified.",Materials,Materials,State Street Global Advisors,PCX,,124,51.380001068115234,15343499.193548389,732250253.56868,54,ETF,3695439616.0,commodity,PASS,
GDXJ,VanEck Vectors Junior Gold Miners ETF,USD,"The investment seeks to replicate as closely as possible, before fees and expenses, the price and yield performance of the MVISÂ® Global Junior Gold Miners Index.
 The fund normally invests at least 80% of its total assets in securities that comprise the index. The index includes companies that generate at least 50% of their revenues from gold and/or silver mining/royalties/streaming or have mining projects with the potential to generate at least 50% of their revenues from gold and/or silver when developed. It is non-diversified.",Materials,Materials,VanEck Asset Management,PCX,,124,129.3800048828125,6227232.258064516,726733609.3228863,55,ETF,9021971456.0,commodity,PASS,
VUG,Vanguard Growth Index Fund ETF Shares,USD,"The investment seeks to track the performance of the CRSP US Large Cap Growth Index that measures the investment return of large-capitalization growth stocks.
 The fund employs an indexing investment approach designed to track the performance of the index, a broadly diversified index predominantly made up of growth stocks of large U.S. companies. The advisor attempts to replicate the target index by investing all, or substantially all, of its assets in the stocks that make up the index, holding each stock in approximately the same proportion as its weighting in the index.",Financials,Growth,Vanguard Asset Management,PCX,,124,485.6600036621094,1539028.2258064516,726100407.8504255,56,ETF,117562261504.0,equity,PASS,
ARKK,ARK Innovation ETF,USD,"The investment seeks long-term growth of capital.
 The fund is an actively-managed exchange-traded fund (""ETF"") that will invest under normal circumstances primarily (at least 65% of its assets) in domestic and foreign equity securities of companies that are relevant to the fund&#39;s investment theme of disruptive innovation. Its investments in foreign equity securities will be in both developed and emerging markets. It may invest in foreign securities (including investments in American Depositary Receipts (""ADRs"") and Global Depositary Receipts (""GDRs"")) and securities listed on local foreign exchanges. The fund is non-diversified.",Information Technology,Factors,ARK ETF Trust,PCX,,124,77.47000122070312,9449466.129032258,717794176.8358877,57,ETF,5980084736.0,equity,PASS,
IYR,iShares U.S. Real Estate ETF,USD,"The investment seeks to track the investment results of the Dow Jones U.S. Real Estate Capped Index.
 The fund seeks to track the investment results of the Dow Jones U.S. Real Estate Capped Index, which measures the performance of the real estate sector of the U.S. equity market, as defined by the ""index provider"". It generally invests at least 90% of its assets in securities of the underlying index and in depositary receipts representing securities of the underlying index.",Real Estate,REITs,BlackRock Asset Management,PCX,,124,100.47000122070312,7375583.064516129,708089454.2874552,58,ETF,4958194688.0,equity,PASS,
EWJ,iShares MSCI Japan ETF,USD,"The investment seeks to track the investment results of the MSCI Japan Index.
 The fund will at all times invest at least 90% of its assets in the securities of its underlying index and in depositary receipts representing securities in its underlying index. The underlying index primarily consists of stocks traded on the Tokyo Stock Exchange. It will include large- and mid-capitalization companies and may change over time.",Equities,Developed Markets,BlackRock Asset Management,PCX,,124,89.06999969482422,8332652.419354838,707457037.2724288,59,ETF,20294598656.0,equity,PASS,
VT,Vanguard Total World Stock Index Fund ETF Shares,USD,"The investment seeks to track the performance of a benchmark index that measures the investment return of stocks of companies located in developed and emerging markets around the world.
 The fund employs an indexing investment approach designed to track the performance of the FTSE Global All Cap Index. The advisor attempts to sample the target index by investing all, or substantially all, of its assets in common stocks in the index and by holding a representative sample of securities that resembles the full index in terms of key risk factors and other characteristics.",Financials,Blend,Vanguard Asset Management,PCX,,124,148.6199951171875,4567678.225806451,648230292.8642519,64,ETF,79217811456.0,equity,PASS,
VWO,Vanguard FTSE Emerging Markets Index Fund ETF Shares,USD,"The investment seeks to track the performance of a benchmark index that measures the investment return of stocks issued by companies located in emerging market countries.
 The fund employs an indexing investment approach designed to track the performance of the FTSE Emerging Markets All Cap China A Inclusion Index. It invests by sampling the index, meaning that it holds a broadly diversified collection of securities that, in the aggregate, approximates the index in terms of key characteristics.",Financials,Emerging Markets,Vanguard Asset Management,PCX,,124,58.09000015258789,11145454.032258064,612930974.2999231,66,ETF,82378588160.0,equity,PASS,
VXUS,Vanguard Total International Stock Index Fund ETF Shares,USD,"The investment seeks to track the performance of a benchmark index that measures the investment return of stocks issued by companies located in developed and emerging markets, excluding the United States.
 The fund employs an indexing investment approach designed to track the performance of the FTSE Global All Cap ex US Index, a float-adjusted market-capitalization-weighted index designed to measure equity market performance of companies located in developed and emerging markets, excluding the United States. It invests all, or substantially all, of its assets in the common stocks included in its target index.",Financials,Developed Markets,Vanguard Asset Management,NGM,,124,82.6500015258789,7874307.258064516,612352330.6833882,67,ETF,582269730816.0,equity,PASS,
XOP,SPDR S&P Oil & Gas Exploration & Production ETF,USD,"The investment seeks to provide investment results that, before fees and expenses, correspond generally to the total return performance of an index derived from the oil and gas exploration and production segment of a U.S. total market composite index.
 In seeking to track the performance of the S&P Oil & Gas Exploration & Production Select Industry Index, the fund employs a sampling strategy. It generally invests substantially all, but at least 80%, of its total assets in the securities comprising the index. The index represents the oil and gas exploration and production segment of the S&P Total Market Index (""S&P TMI"").",Energy,Energy,State Street Global Advisors,PCX,,124,164.25999450683594,4082446.7741935486,603960523.2028469,68,ETF,11580329984.0,commodity,PASS,
IWB,iShares Russell 1000 ETF,USD,"The investment seeks to track the investment results of the Russell 1000Â® Index, which measures the performance of large- and mid- capitalization sectors of the U.S. equity market.
 The fund generally invests at least 90% of its assets in securities of the underlying index and in depositary receipts representing securities of the underlying index. It may invest the remainder of its assets in certain futures, options and swap contracts, cash and cash equivalents, as well as in securities not included in the underlying index, but which the advisor believes will help the fund track the underlying index.",Equities,Large Cap,BlackRock Asset Management,PCX,,124,383.3200073242187,1457299.1935483871,538087367.2301754,70,ETF,48010829824.0,equity,PASS,
IVW,iShares S&P 500 Growth ETF,USD,"The investment seeks to track the investment results of the S&P 500 Growth IndexTM, which measures the performance of the large-capitalization growth sector of the U.S. equity market.
 The fund generally invests at least 90% of its assets in securities of the underlying index and in depositary receipts representing securities of the underlying index. It may invest the remainder of its assets in certain futures, options and swap contracts, cash and cash equivalents, as well as in securities not included in the underlying index, but which BFA believes will help the fund track the underlying index.",Equities,Growth,BlackRock Asset Management,PCX,,124,126.33999633789062,3915795.967741935,470144523.6254846,75,ETF,16525271040.0,equity,PASS,
VGT,Vanguard Information Technology Index Fund ETF Shares,USD,"The investment seeks to track the performance of a benchmark index.
 The fund employs an indexing investment approach designed to track the performance of the MSCI US Investable Market Index/Information Technology 25/50, an index made up of stocks of large, mid-size, and small U.S. companies within the information technology sector, as classified under the Global Industry Classification Standard. The Advisor attempts to replicate the target index by seeking to invest all, or substantially all, of its assets in the stocks that make up the index, in order to hold each stock in approximately the same proportion as its weighting in the index. It is non-diversified.",Information Technology,Developed Markets,Vanguard Asset Management,PCX,,124,784.02001953125,541477.4193548387,402981823.761134,80,ETF,121284206592.0,equity,PASS,
INDA,iShares MSCI India ETF,USD,"The investment seeks to track the investment results of the MSCI India Index composed of Indian equities.
 The fund generally will collectively invest at least 90% of the fund&#39;s assets in the component securities of the underlying index and in investments that have economic characteristics that are substantially identical to the component securities of the underlying index. The index measures the performance of equity securities of companies whose market capitalization, as calculated by the index provider, represents the large and mid-capitalization segments of the Indian securities market. The fund is non-diversified.",Equities,Emerging Markets,BlackRock Asset Management,BTS,,124,49.97999954223633,7728691.129032258,398792995.4062031,81,ETF,6745649664.0,equity,PASS,
VTWO,Vanguard Russell 2000 Index Fund ETF Shares,USD,"The investment seeks to track the performance of a benchmark index that measures the investment return of small-capitalization stocks in the United States.
 The fund employs an indexing investment approach designed to track the performance of the Russell 2000Â® Index. The index is designed to measure the performance of small-capitalization stocks in the United States. The advisor attempts to replicate the target index by investing all, or substantially all, of its assets in the stocks that make up the index, holding each stock in approximately the same proportion as its weighting in the index.",Financials,Small Cap,Vanguard Asset Management,NMS,,124,108.83999633789062,3741835.483870968,382717305.7916026,83,ETF,14520372224.0,equity,PASS,
VNQ,Vanguard Real Estate Index Fund ETF Shares,USD,"The investment seeks to provide a high level of income and moderate long-term capital appreciation by tracking the performance of the MSCI US Investable Market Real Estate 25/50 Index that measures the performance of publicly traded equity REITs and other real estate-related investments.
 The advisor attempts to track the index by investing all, or substantially all, of its assets-either directly or indirectly through a wholly owned subsidiary, which is itself a registered investment company-in the stocks that make up the index, holding each stock in approximately the same proportion as its weighting in the index. The fund is non-diversified.",Real Estate,REITs,Vanguard Asset Management,PCX,,124,94.29000091552734,3994151.6129032257,358221199.03085154,84,ETF,34904367104.0,equity,PASS,
EWT,iShares MSCI Taiwan ETF,USD,"The investment seeks to track the investment results of the MSCI Taiwan 25/50 Index.
 The fund will at all times invest at least 80% of its assets in the securities of its underlying index and in depositary receipts representing securities in its underlying index. The index is designed to measure the performance of the large- and mid-cap segments of the Taiwanese market. A capping methodology is applied that limits the weight of any single issuer to a maximum of 25% of the underlying index. The fund is non-diversified.",Equities,Emerging Markets,BlackRock Asset Management,PCX,,124,80.73999786376953,5215772.580645162,357319468.5505836,85,ETF,6862899712.0,equity,PASS,
XLRE,The Real Estate Select Sector SPDR Fund,USD,"The investment seeks to provide investment results that, before expenses, correspond generally to the price and yield performance of publicly traded equity securities of companies in the Real Estate Select Sector Index (the ""index"").
 Under normal market conditions, the fund generally invests substantially all, but at least 95%, of its total assets in the securities comprising the index. The index includes securities of companies from the following industries: real estate management and development and REITs, excluding mortgage REITs. The fund is non-diversified.",Real Estate,REITs,State Street Global Advisors,PCX,,124,43.40999984741211,8645918.548387097,356308653.37335217,86,ETF,7306239488.0,equity,PASS,
OEF,iShares S&P 100 ETF,USD,"The investment seeks to track the investment results of the S&P 100Â®, which measures the performance of the large-capitalization sector of the U.S. equity market.
 The fund generally invests at least 90% of its assets in securities of the underlying index and in depositary receipts representing securities of the underlying index. It may invest the remainder of its assets in certain futures, options and swap contracts, cash and cash equivalents, including shares of money market funds advised by BFA or its affiliates, as well as in securities not included in the underlying index, but which the advisor believes will help the fund track the underlying index.",Financials,Large Cap,BlackRock Asset Management,PCX,,124,345.1199951171875,1021706.4516129032,338121794.24089,89,ETF,13459680256.0,equity,PASS,
VONG,Vanguard Russell 1000 Growth Index Fund ETF Shares,USD,"The investment seeks to track the performance of the Russell 1000Â® Growth Index.
 The index is designed to measure the performance of large-capitalization growth stocks in the United States. The Advisor attempts to replicate the target index by investing all, or substantially all, of its assets in the stocks that make up the index, holding each stock in approximately the same proportion as its weighting in the index. The fund may become non-diversified, as defined under the Investment Company Act of 1940, solely as a result of a change in relative market capitalization or index weighting of one or more constituents of the index.",Financials,Growth,Vanguard Asset Management,NMS,,124,120.6500015258789,2775600.806451613,326830099.1807261,91,ETF,44948783104.0,equity,PASS,
COPX,Global X Copper Miners ETF,USD,"The investment seeks to provide investment results that correspond generally to the price and yield performance, before fees and expenses, of the Solactive Global Copper Miners Total Return Index.
 The fund invests at least 80% of its total assets in the securities of the underlying index and in American Depositary Receipts (""ADRs"") and Global Depositary Receipts (""GDRs"") based on the securities in the underlying index. The underlying index is designed to measure broad-based equity market performance of global companies involved in the copper mining industry. The fund is non-diversified.",Materials,Materials,Global X Funds,PCX,,124,86.08000183105469,4096495.1612903224,322932229.43061703,92,ETF,6707480576.0,equity,PASS,
IBB,iShares Nasdaq Biotechnology ETF,USD,"The investment seeks to track the investment results of the NASDAQ Biotechnology Index, which contains securities of companies listed on NASDAQ that are classified according to the Industry Classification Benchmark as either biotechnology or pharmaceuticals and that also meet other eligibility criteria determined by Nasdaq, Inc.
 The fund generally invests at least 90% of its assets in securities of the index and in depositary receipts representing securities of the index. It may invest the remainder of its assets in certain futures, options and swap contracts, cash and cash equivalents. It is non-diversified.",Health Care,Developed Markets,BlackRock Asset Management,NMS,,124,175.99000549316406,1908880.6451612904,320304345.0918505,93,ETF,12266503168.0,equity,PASS,
SGOL,Aberdeen Standard Gold ETF Trust,USD,"The investment seeks to reflect the performance of the price of gold bullion, less the Trustâs expenses.
 The Shares are intended to constitute a simple and cost-effective means of making an investment similar to an investment in gold. An investment in physical gold requires expensive and sometimes complicated arrangements in connection with the assay, transportation, warehousing and insurance of the metal. Although the Shares are not the exact equivalent of an investment in gold, they provide investors with an alternative that allows a level of participation in the gold market through the securities market.",Commodities,,Aberdeen Standard Investments,PCX,,124,45.68000030517578,6904816.129032258,303128933.83258694,96,ETF,7866952704.0,commodity,PASS,
JEPI,JPMorgan Equity Premium Income ETF,USD,"The investment seeks current income while maintaining prospects for capital appreciation.
 The fund seeks to provide the majority of the returns associated with its primary benchmark, the Standard & Poor&#39;s 500 Total Return Index (S&P 500 Index), while exposing investors to less risk through lower volatility and still offering incremental income. Under normal circumstances, the fund invests at least 80% of its assets in equity securities. It may also invest in other equity securities not included in the S&P 500 Index.",Financials,Developed Markets,JPMorgan Asset Management,PCX,,124,57.61000061035156,5338408.870967742,301816306.8427578,97,ETF,43964334080.0,equity,PASS,
VGK,Vanguard FTSE Europe Index Fund ETF Shares,USD,"The investment seeks to track the performance of a benchmark index that measures the investment return of stocks issued by companies located in the major markets of Europe.
 The fund employs an indexing investment approach by investing all, or substantially all, of its assets in the common stocks included in the FTSE Developed Europe All Cap Index. The index is a market-capitalization-weighted index.",Equities,Developed Markets,Vanguard Asset Management,PCX,,124,88.02999877929688,3581557.2580645164,298678906.35503954,98,ETF,24832645120.0,equity,PASS,
SIL,Global X Silver Miners ETF,USD,"The investment seeks to provide investment results that correspond generally to the price and yield performance, before fees and expenses, of the Solactive Global Silver Miners Total Return Index.
 The fund invests at least 80% of its total assets in the securities of the underlying index and in American Depositary Receipts (""ADRs"") and Global Depositary Receipts (""GDRs"") based on the securities in the underlying index. The underlying index is designed to measure broad-based equity market performance of global companies involved in the silver mining industry. The fund is non-diversified.",Materials,Materials,Global X Funds,PCX,,124,97.58999633789062,3274415.3225806453,295490605.6173386,101,ETF,5131136000.0,commodity,PASS,
SIVR,Aberdeen Standard Physical Silver Shares ETF,USD,"The investment seeks to track the price of physical silver bullion (Silver ETPs).
 The shares are intended to constitute a simple and cost-effective means of making an investment similar to an investment in silver. An investment in physical silver requires expensive and sometimes complicated arrangements in connection with the assay, transportation, warehousing and insurance of the metal. Although the shares are not the exact equivalent of an investment in silver, they provide investors with an alternative that allows a level of participation in the silver market through the securities market.",Commodities,,Aberdeen Standard Investments,PCX,,124,75.5,3790380.64516129,283850421.5802654,103,ETF,4970486784.0,commodity,PASS,
