symbol,name,currency,summary,category_group,category,family,exchange,isin,trading_days,last_price,avg_volume,avg_dollar_volume,liquidity_rank,asset_type,size_metric,market_bucket,candidate_status,candidate_fail_reasons
SILJ,ETFMG Prime Junior Silver Miners ETF,USD,"The investment seeks investment results that, before fees and expenses, correspond generally to thetotal return performance of the Prime Junior Silver Miners & Explorers Index.
 The index tracks the performance of the equity securities (or corresponding American Depositary Receipts (""ADRs"") or Global Depositary Receipts (""GDRs"")) of small-capitalization companies actively engaged in silver refining, mining, or exploration (""Junior Silver Companies""). The fund invests at least 80% of its total assets in the component securities of the index and in ADRs and GDRs based on the component securities in the index. The fund is non-diversified.",Materials,Materials,ETF Management,PCX,,124,31.88999938964844,9152934.677419355,276113507.0799305,104,ETF,4027863296.0,commodity,PASS,
VEU,Vanguard FTSE All-World ex-US Index Fund ETF Shares,USD,"The investment seeks to track the performance of a benchmark index that measures the investment return of stocks of companies located in developed and emerging markets outside of the United States.
 The fund employs an indexing investment approach designed to track the performance of the FTSE All-World ex US Index. The advisor attempts to replicate the target index by investing all, or substantially all, of its assets in the stocks that make up the index, holding each stock in approximately the same proportion as its weighting in the index.",Real Estate,Developed Markets,Vanguard Asset Management,PCX,,124,80.48999786376953,3648478.2258064514,276090705.256499,105,ETF,37239341056.0,equity,PASS,
IWR,iShares Russell Mid-Cap ETF,USD,"The investment seeks to track the investment results of the Russell Midcap Index, which measures the performance of the mid-capitalization sector of the U.S. equity market.
 The fund generally invests at least 90% of its assets in securities of the underlying index and in depositary receipts representing securities of the underlying index. It may invest the remainder of its assets in certain futures, options and swap contracts, cash and cash equivalents, as well as in securities not included in the underlying index, but which the advisor believes will help the fund track the underlying index.",Equities,Mid Cap,BlackRock Asset Management,PCX,,124,102.26000213623048,2742337.9032258065,268095833.45227396,106,ETF,35755208704.0,equity,PASS,
URA,Global X Uranium ETF,USD,"The investment seeks to provide investment results that correspond generally to the price and yield performance, before fees and expenses, of the Solactive Global Uranium & Nuclear Components Total Return Index.
 The fund invests at least 80% of its total assets in the securities of the underlying index and in American Depositary Receipts (""ADRs"") and Global Depositary Receipts (""GDRs"") based on the securities in the underlying index. The underlying index is designed to measure broad based equity market performance of global companies involved in the uranium industry. The fund is non-diversified.",Materials,Developed Markets,Global X Funds,PCX,,124,54.84000015258789,5276475.0,263317022.5834723,107,ETF,6505265152.0,equity,PASS,
IVE,iShares S&P 500 Value ETF,USD,"The investment seeks to track the investment results of the S&P 500 Value IndexTM, which measures the performance of the large-capitalization value sector of the U.S. equity market.
 The fund generally invests at least 90% of its assets in securities of the underlying index and in depositary receipts representing securities of the underlying index. It may invest the remainder of its assets in certain futures, options and swap contracts, cash and cash equivalents, as well as in securities not included in the underlying index, but which the advisor believes will help the fund track the underlying index.",Equities,Value,BlackRock Asset Management,PCX,,124,218.0099945068359,1233208.8709677418,260902961.7709006,109,ETF,28984428544.0,equity,PASS,
IYW,iShares U.S. Technology ETF,USD,"The investment seeks to track the investment results of the Dow Jones U.S. Technology Capped Index.
 The fund generally invests at least 90% of its assets in securities of the underlying index and in depositary receipts representing securities of the underlying index. The underlying index measures the performance of U.S. companies in the technology sector. The fund is non-diversified.",Information Technology,Technology,BlackRock Asset Management,PCX,,124,205.22999572753903,1350269.3548387096,260861186.4598305,110,ETF,4237999360.0,equity,PASS,
SCHB,Schwab U.S. Broad Market ETF,USD,"The investment seeks to track as closely as possible, before fees and expenses, the total return of the Dow Jones U.S. Broad Stock Market Index.
 To pursue its goal, the fund generally invests in stocks that are included in the index. The index includes the largest 2,500 publicly traded U.S. companies for which pricing information is readily available. The fund will invest at least 90% of its net assets in these stocks. It may invest up to 10% of its net assets in securities not included in the index.",Financials,Large Cap,Schwab ETFs,PCX,,124,27.010000228881836,9665991.129032258,250923590.7035305,112,ETF,36927254528.0,equity,PASS,
VYM,Vanguard High Dividend Yield Index Fund ETF Shares,USD,"The investment seeks to track the performance of a benchmark index that measures the investment return of common stocks of companies that are characterized by high dividend yield.
 The fund employs an indexing investment approach designed to track the performance of the FTSE High Dividend Yield Index, which consists of common stocks of companies that pay dividends that generally are higher than average. The adviser attempts to replicate the target index by investing all, or substantially all, of its assets in the stocks that make up the index, holding each stock in approximately the same proportion as its weighting in the index.",Financials,Value,Vanguard Asset Management,PCX,,124,153.0500030517578,1700929.838709677,247920705.1206527,113,ETF,88722817024.0,equity,PASS,
DYNF,BlackRock U.S. Equity Factor Rotation ETF,USD,"The investment seeks to outperform the investment results of the large- and mid-capitalization U.S. equity markets by providing diversified and tactical exposure to style factors via a factor rotation model.
 The fund seeks to achieve its investment objective by investing, under normal circumstances, at least 80% of its net assets plus the amount of any borrowings for investment purposes in U.S. listed common stock of large- and mid-capitalization companies selected based on a proprietary Factor Rotation model developed by BFA and its affiliates. It is non-diversified.",Financials,Large Cap,BlackRock Asset Management,PCX,,124,62.91999816894531,4097727.419354839,246177628.40633085,114,ETF,30008514560.0,equity,PASS,
SPDW,SPDR Portfolio Developed World ex-US ETF,USD,"The investment seeks investment results that, before fees and expenses, correspond generally to the total return performance of the S&P Developed Ex-U.S. BMI Index.
 The fund generally invests substantially all, but at least 80%, of its total assets in the securities comprising the index and in depositary receipts based on securities comprising the index. The index is a market capitalization weighted index designed to define and measure the investable universe of publicly traded companies domiciled in developed countries outside the United States.",Financials,Developed Markets,State Street Global Advisors,PCX,,124,48.880001068115234,5161835.483870967,234991670.79376405,118,ETF,35649814528.0,equity,PASS,
USMV,iShares MSCI USA Min Vol Factor ETF,USD,"The investment seeks the investment results of the MSCI USA Minimum Volatility (USD) Index.
 The fund will invest at least 90% of its assets in the component securities of the index and may invest up to 10% of its assets in certain futures, options and swap contracts, cash and cash equivalents. The index measures the performance of large and mid-capitalization equity securities listed on stock exchanges in the U.S. that, in the aggregate, have lower volatility relative to the large- and mid-cap U.S. equity market.",Equities,Large Cap,BlackRock Asset Management,BTS,,124,93.94000244140624,2470980.64516129,232411652.58852437,119,ETF,22560100352.0,equity,PASS,
VO,Vanguard Mid-Cap Index Fund ETF Shares,USD,"The investment seeks to track the performance of the CRSP US Mid Cap Index that measures the investment return of mid-capitalization stocks.
 The fund employs an indexing investment approach designed to track the performance of the CRSP US Mid Cap Index, a broadly diversified index of stocks of mid-size U.S. companies. The advisor attempts to replicate the target index by investing all, or substantially all, of its assets in the stocks that make up the index, holding each stock in approximately the same proportion as its weighting in the index.",Financials,Mid Cap,Vanguard Asset Management,PCX,,124,301.9100036621094,791190.3225806452,231791106.7842545,120,ETF,46485987328.0,equity,PASS,
EMXC,iShares MSCI Emerging Markets ex China ETF,USD,"The investment seeks to track the investment results of the MSCI Emerging Markets ex China Index (the ""underlying index"").
 The fund generally will invest at least 90% of its assets in the component securities (including indirect investments through an underlying fund) of the underlying index. The underlying index is a free float-adjusted market capitalization weighted index that captures large- and mid-capitalization stocks across 25 of the 26 Emerging Markets countries (as defined by MSCI Inc. (the ""index provider"" or ""MSCI"")), excluding China.",Financials,Emerging Markets,BlackRock Asset Management,NGM,,124,87.68000030517578,2914387.0967741935,228048657.46732527,121,ETF,17542797312.0,equity,PASS,
EFV,iShares MSCI EAFE Value ETF,USD,"The investment seeks to track the investment results of the MSCI EAFE Value Index composed of developed market equities, excluding the U.S. and Canada, that exhibit value characteristics.
 The fund generally invests at least 90% of its assets in securities of the underlying index and in depositary receipts representing securities of the underlying index. The underlying index is a subset of the MSCI EAFE Index. Constituents of the underlying index include securities from Europe, Australasia and the Far East.",Equities,Value,BlackRock Asset Management,BTS,,124,78.25,3136360.483870968,227323529.1637728,122,ETF,28638212096.0,equity,PASS,
IXUS,iShares Core MSCI Total International Stock ETF,USD,"The investment seeks to track the investment results of the MSCI ACWI ex USA IMI composed of large-, mid- and small-capitalization non-U.S. equities.
 The fund generally will invest at least 90% of its assets in the component securities of the underlying index and in investments that have economic characteristics that are substantially identical to the component securities of the underlying index. The index is a free float-adjusted market capitalization index designed to measure the combined equity market performance of developed and emerging markets countries, excluding the United States.",Equities,Factors,BlackRock Asset Management,NMS,,124,92.93000030517578,2605970.9677419355,226573616.2315861,124,ETF,51986108416.0,equity,PASS,
SCHH,Schwab U.S. REIT ETF,USD,"The investment seeks to track as closely as possible, before fees and expenses, the total return of the Dow Jones Equity All REIT Capped Index, which is composed of U.S. real estate investment trusts classified as equities.
 The index excludes mortgage REITs, defined as REITs that lend money directly to real estate owners and/or operators or indirectly through the purchase of mortgages or mortgage-backed securities, and hybrid REITs, defined as REITs that participate both in equity and mortgage investing. It is the fundâs policy that under normal circumstances it will invest at least 90% of its net assets in securities included in the index.",Real Estate,REITs,Schwab ETFs,PCX,,124,22.8799991607666,10326016.129032258,220890581.66930905,127,ETF,9150117888.0,equity,PASS,
ITA,iShares U.S. Aerospace & Defense ETF,USD,"The investment seeks to track the investment results of the Dow Jones U.S. Select Aerospace & Defense Index composed of U.S. equities in the aerospace and defense sector.
 The fund generally invests at least 90% of its assets in securities of the underlying index and in depositary receipts representing securities of the underlying index. The underlying index measures the performance of the aerospace and defense sector of the U.S. equity market. Aerospace companies in the index include manufacturers, assemblers and distributors of aircraft and aircraft parts. The fund is non-diversified.",Industrials,Value,BlackRock Asset Management,BTS,,124,234.0,919008.0645161292,208910011.6827688,129,ETF,13488702464.0,equity,PASS,
MTUM,iShares MSCI USA Momentum Factor ETF,USD,"The investment seeks to track the investment results of the MSCI USA Momentum SR Variant Index.
 The fund generally will invest at least 90% of its assets in the component securities of the underlying index and may invest up to 10% of its assets in certain futures, options and swap contracts, cash and cash equivalents. The index consists of stocks exhibiting relatively higher momentum characteristics from the traditional market capitalization-weighted parent index, the MSCI USA Index, as determined by MSCI Inc.",Information Technology,Large Cap,BlackRock Asset Management,BTS,,124,269.989990234375,834438.7096774194,208123041.74457672,132,ETF,20236066816.0,equity,PASS,
SPYV,SPDR Portfolio S&P 500 Value ETF,USD,"The investment seeks to provide investment results that, before fees and expenses, correspond generally to the total return performance of the S&P 500 Value Index that tracks the performance of large capitalization exchange traded U.S. equity securities exhibiting ""value"" characteristics.
 The fund employs a sampling strategy in seeking to track the performance of the S&P 500 Value Index. It generally invests substantially all, but at least 80%, of its total assets in the securities comprising the index. The index measures the performance of the large-capitalization value segment of the U.S. equity market.",Equities,Value,State Street Global Advisors,PCX,,124,58.40999984741211,3632704.032258065,206494045.3417778,133,ETF,5216182272.0,equity,PASS,
SPMO,Invesco S&P 500 Momentum ETF,USD,"The investment seeks to track the investment results (before fees and expenses) of the S&P 500 Momentum Index (the ""underlying index"").
 The fund generally will invest at least 90% of its total assets in the securities that comprise the underlying index. The underlying index is designed to track the performance of approximately 100 stocks in the S&P 500Â® Index that have the highest ""momentum score."" In general, momentum is the tendency of an investment to exhibit persistence in its relative performance; a ""momentum style"" of investing emphasizes investing in securities that have had better recent performance compared to other securities. It is non-diversified.",Financials,Large Cap,Invesco Investment Management,PCX,,124,126.58000183105467,1711172.5806451612,202623951.28858012,135,ETF,12323705856.0,equity,PASS,
